{
  "schemaVersion": 1,
  "revision": 9,
  "catalogVersion": "1.5.0",
  "publishedAt": "2026-10-15T18:31:09Z",
  "makes": [
    "VOGE",
    "ZONTES",
    "KOVE"
  ],
  "models": [
    {
      "id": "kove-800x-pro-2026",
      "make": "KOVE",
      "model": "800X Pro",
      "year": 2026,
      "status": "unverified",
      "notes": "Producent potwierdza skok 240/240 mm. Nie publikujemy klików ani bazowych nastaw bez ich sprawdzenia w instrukcji dla właściwej wersji CN4/E5+.",
      "sources": [
        {
          "id": "kove-800x-pro-2026-spec",
          "title": "KOVE · 800X PRO CN4/E5+ · specyfikacja producenta",
          "url": "https://www.kovemoto.com/kove-800x-pro",
          "retrievedAt": "2026-10-15T18:31:09Z",
          "notes": "Producent podaje skok przód/tył po 240 mm oraz regulację napięcia wstępnego. Parametry techniczne nie są zaleceniem nastawy."
        },
        {
          "id": "kove-800x-pro-2026-manual",
          "title": "KOVE · instrukcja 800X Pro · wydanie 2026",
          "url": "https://www.kovemoto.com/wp-content/uploads/2026/08/800X-PRO-2026-USER-MANUAL-2026.03.pdf",
          "retrievedAt": "2026-10-15T18:31:09Z",
          "notes": "Instrukcja udostępniona w serwisie producenta KOVE. Nastawy pozostają nieopublikowane do czasu sprawdzenia dokładnej treści i zgodności z wersją sprzedawaną w Polsce."
        }
      ],
      "specifications": [
        {
          "kind": "travel",
          "side": "front",
          "name": "Skok zawieszenia",
          "value": 240,
          "unit": "mm",
          "sourceIds": [
            "kove-800x-pro-2026-spec"
          ]
        },
        {
          "kind": "travel",
          "side": "rear",
          "name": "Skok zawieszenia",
          "value": 240,
          "unit": "mm",
          "sourceIds": [
            "kove-800x-pro-2026-spec"
          ]
        }
      ],
      "settings": []
    },
    {
      "id": "kove-800x-touring-2026",
      "make": "KOVE",
      "model": "800 X Touring",
      "year": 2026,
      "status": "unverified",
      "notes": "Skok zawieszenia przód/tył 210/210 mm według strony producenta KOVE. Nie są dostępne zweryfikowane nastawy bazowe dla właściwego rocznika.",
      "sources": [
        {
          "id": "kove-800x-touring-spec",
          "title": "KOVE · 800X Touring · specyfikacja producenta",
          "url": "https://de.kovemoto.com/800x-touring",
          "retrievedAt": "2026-10-15T18:31:09Z",
          "notes": "Oficjalna regionalna strona KOVE podaje skok zawieszenia przód/tył 210/210 mm. Parametry techniczne nie są zaleceniem nastawy."
        }
      ],
      "specifications": [
        {
          "kind": "travel",
          "side": "front",
          "name": "Skok zawieszenia",
          "value": 210,
          "unit": "mm",
          "sourceIds": ["kove-800x-touring-spec"]
        },
        {
          "kind": "travel",
          "side": "rear",
          "name": "Skok zawieszenia",
          "value": 210,
          "unit": "mm",
          "sourceIds": ["kove-800x-touring-spec"]
        }
      ],
      "settings": []
    },
    {
      "id": "voge-900-dsx-2026",
      "make": "VOGE",
      "model": "900 DSX",
      "year": 2026,
      "status": "verified",
      "notes": "Nastawy pochodzą z instrukcji VOGE 900 DSX E5+. Sprawdź, czy homologacja i osprzęt Twojego motocykla odpowiadają tej wersji. Wartości obciążeniowe z tyłu dla trzech kufrów.",
      "sources": [
        {
          "id": "voge-900-dsx-2026-spec",
          "title": "VOGE Polska · 900 DSX · specyfikacja producenta",
          "url": "https://voge.pl/modele/900-dsx",
          "retrievedAt": "2026-10-15T18:31:09Z",
          "notes": "Oficjalna strona VOGE Polska podaje skok przód/tył 194/198 mm. Parametry techniczne nie są zaleceniem nastawy."
        },
        {
          "id": "voge-900-dsx-e5-plus-manual",
          "title": "VOGE 900 DSX E5+ · instrukcja obsługi · regulacja zawieszenia",
          "url": "https://vogespain.es/wp-content/uploads/Manual-de-Propietario-Voge-900DSX-Euro-5-Espanol.pdf",
          "retrievedAt": "2026-10-15T18:31:09Z",
          "notes": "Instrukcja producenta VOGE Hiszpania, strony 116–119. Podaje kierunek działania przednich regulatorów oraz pozycje tylnego pokrętła dla jazdy solo i z bagażem. Wstępne napięcie sprężyny regulowane pierścieniem wymaga narzędzi i warsztatu."
        }
      ],
      "specifications": [
        {
          "kind": "travel",
          "side": "front",
          "name": "Skok zawieszenia",
          "value": 194,
          "unit": "mm",
          "sourceIds": [
            "voge-900-dsx-2026-spec"
          ]
        },
        {
          "kind": "travel",
          "side": "rear",
          "name": "Skok zawieszenia",
          "value": 198,
          "unit": "mm",
          "sourceIds": [
            "voge-900-dsx-2026-spec"
          ]
        }
      ],
      "settings": [
        {
          "side": "front",
          "name": "Napięcie wstępne sprężyny",
          "value": "w lewo = mniejsze; w prawo = większe",
          "context": "Instrukcja E5+ nie podaje liczby obrotów bazowych dla przodu.",
          "sourceIds": [
            "voge-900-dsx-e5-plus-manual"
          ]
        },
        {
          "side": "front",
          "name": "Odbicie · lewa laga",
          "value": "w lewo = szybszy powrót; w prawo = wolniejszy",
          "context": "Regulator nr 2. Nie obracaj pokrętła na siłę do oporu.",
          "sourceIds": [
            "voge-900-dsx-e5-plus-manual"
          ]
        },
        {
          "side": "front",
          "name": "Kompresja · prawa laga",
          "value": "w lewo = słabsze tłumienie; w prawo = mocniejsze",
          "context": "Regulator nr 3. Nie obracaj pokrętła na siłę do oporu.",
          "sourceIds": [
            "voge-900-dsx-e5-plus-manual"
          ]
        },
        {
          "side": "rear",
          "name": "Napięcie wstępne · solo, bez bagażu",
          "value": 6,
          "unit": "klików",
          "context": "Pokrętło hydrauliczne nr 1: od lewego ogranicznika w prawo. Instrukcja określa to jako pozycję seryjną.",
          "sourceIds": [
            "voge-900-dsx-e5-plus-manual"
          ]
        },
        {
          "side": "rear",
          "name": "Napięcie wstępne · solo, 3 kufry",
          "value": "16 ± 1",
          "unit": "klików",
          "context": "Od lewego ogranicznika w prawo.",
          "sourceIds": [
            "voge-900-dsx-e5-plus-manual"
          ]
        },
        {
          "side": "rear",
          "name": "Napięcie wstępne · kierowca + pasażer, 3 kufry",
          "value": "21 ± 1",
          "unit": "klików",
          "context": "Od lewego ogranicznika w prawo.",
          "sourceIds": [
            "voge-900-dsx-e5-plus-manual"
          ]
        },
        {
          "side": "rear",
          "name": "Odbicie · solo, bez bagażu",
          "value": 18,
          "unit": "klików",
          "context": "Od prawego ogranicznika w lewo; pozycja seryjna. W lewo szybszy powrót, w prawo wolniejszy.",
          "sourceIds": [
            "voge-900-dsx-e5-plus-manual"
          ]
        },
        {
          "side": "rear",
          "name": "Odbicie · solo, 3 kufry",
          "value": "16 ± 1",
          "unit": "klików",
          "context": "Od prawego ogranicznika w lewo.",
          "sourceIds": [
            "voge-900-dsx-e5-plus-manual"
          ]
        },
        {
          "side": "rear",
          "name": "Odbicie · kierowca + pasażer, 3 kufry",
          "value": "14 ± 1",
          "unit": "klików",
          "context": "Od prawego ogranicznika w lewo.",
          "sourceIds": [
            "voge-900-dsx-e5-plus-manual"
          ]
        }
      ]
    },
    {
      "id": "zontes-703-f-2026",
      "make": "ZONTES",
      "model": "703 F",
      "year": 2026,
      "status": "unverified",
      "notes": "Producent publikuje osobne instrukcje 2026 dla wersji z kołem 21 i 19 cali. Katalog producenta podaje skok 180/180 mm; nastawy dodamy po potwierdzeniu właściwej wersji i odczytaniu instrukcji.",
      "sources": [
        {
          "id": "zontes-703f-2026-spec",
          "title": "ZONTES Official · 703F MY26 · specyfikacja producenta",
          "url": "https://zontes.eu/it-it/moto/703f-my26/",
          "retrievedAt": "2026-10-15T17:37:41Z",
          "notes": "Oficjalna strona ZONTES podaje skok 180 mm z przodu i 180 mm z tyłu. Parametry techniczne nie są zaleceniem nastawy."
        },
        {
          "id": "zontes-703f-2026-manual-listing",
          "title": "ZONTES · instrukcja obsługi 703F 21 cali · model 2026",
          "url": "https://www.sharpon.com/Tayoimg/DRP/DRPProducts/DRPPageIMG/PdfZT202609161711437858374.pdf",
          "retrievedAt": "2026-10-15T17:34:55Z",
          "notes": "Producent udostępnia oddzielne instrukcje 2026 dla 703F z kołem 21 cali i 19 cali. Należy dobrać instrukcję do rzeczywistej wersji motocykla."
        }
      ],
      "specifications": [
        {
          "kind": "travel",
          "side": "front",
          "name": "Skok zawieszenia",
          "value": 180,
          "unit": "mm",
          "sourceIds": [
            "zontes-703f-2026-spec"
          ]
        },
        {
          "kind": "travel",
          "side": "rear",
          "name": "Skok zawieszenia",
          "value": 180,
          "unit": "mm",
          "sourceIds": [
            "zontes-703f-2026-spec"
          ]
        }
      ],
      "settings": []
    },
    {
      "id": "kove-450-rally-2026",
      "make": "KOVE",
      "model": "450 Rally RE",
      "year": 2026,
      "status": "unverified",
      "notes": "Producent podaje skok 305/300 mm w konfiguracji wysokiej oraz 255/270 mm w niskiej. Brak zweryfikowanych bazowych klików tłumienia dla tej wersji.",
      "sources": [
        {
          "id": "kove-450-rally-re-spec",
          "title": "KOVE · 450 Rally RE · specyfikacja producenta",